app_id,Gender:* Required fields are indicated with red symbol Permanent Contact Information,City (Permanent):* Required fields are indicated with red symbol Permanent Contact Information ,State (Permanent):* Required fields are indicated with red symbol Permanent Contact Information,Zip (Permanent):* Required fields are indicated with red symbol Permanent Contact Information,"Are you Black? (includes African, African American, Caribbean, etc.)",Preferred Mailing Address,College/University:Academic Profile,Classification (as of January 2022):Academic Profile,Major:Academic Profile,Secondary Major:Academic Profile,Expected Graduation Date:Academic Profile,Classification: Other  -  Please specify,"GPA for your Major (For calculating instructions go to: ""http://www.back2college.com/gpa.htm"")","Overall GPA (For calculating instructions go to: ""http://www.back2college.com/gpa.htm"")","Other Colleges/Universities attended ( Please include name, city, state, year(s) attended, and certificate/degree pursued or obtained)",List by description and date your top 3 extracurricular activities and organizational involvement.,"List by description and date any honors, distinctions, and scholarships that you have received (including past NABA scholarship)",Chapter Affiliation (If school is not listed please select At Large):Chapter Information,Current Chapter Leadership Role:Chapter Information,Please list any other chapter leadership roles held ( include dates and roles).  Type (NA) if not applicable,Have you participated in NABA's Accounting Career Awareness Program (ACAP)?,"If yes, what year?",Which Program (City)?,Please indicate sorority or fraternity affiliations,I am interested in an internship.,I have applied for an internship.,"Please provide details (i.e. company name, location, etc.)",I have accepted an internship for the summer of 2022 (June - August),I have accepted an internship for the fall of 2022 (September- December),"Please provide details (i.e. company name, location, etc.).1",I have accepted a permanent job offer,"Please provide details (i.e. company name, location, etc.).2",Have you received a CPA Exam Review?,Which CPA Exam Review have you received?,Copy/ Paste An Essay Response of 500 words or less (copy and paste in webform) using the following prompt: Community disruptions such as Covid-19 and other natural disasters can have deep lasting impacts. Discuss a challenge or barrier you have overcome during the Covid-19 pandemic.,Recipient
89,Female,Hockessin,DE,19707,Yes,Campus/Temporary,Goldey-Beacom College,Junior,Accounting,,4/20/2023,,3.2,3.5,,1. 2019-present: Women College Softball Team. 2. 2020-present: Resident Assistant Staff Member.  3. 2021-present: President of the National Association of Black Accountants,2019-2022 Affordability Assurance Award  2019-2022 Jones Merit Scholarship 2019-2022 Women's Softball Scholarship 2020-2022 Residence Life Staff Scholarship 2021 National Association of Black Accountants Regional Scholarship 2021 National Association of Black Accountants National Scholarship 2019 Fall Presidents List 2020 Spring Deans List 2021 Fall Deans List,At Large,President,,No,,,Rho Alpha Beta Omega Vice President/President Elect 2021-2022,Yes,Yes,"WSFS Bank Summer Intern, PwC Start Intern",Yes,No,PwC Start Program Summer Intern Philadelphia Location,No,,No,,"The challenges I had to overcome during the Covid-19 pandemic were during the first months of the global virus appearance. I was starting my first collegiate softball season in March 2020 when after our first double-header in West Chester, PA, my head coach informed my team and I that our season must come to a halt due to the pandemic. We all had to move off campus immediately. It was disappointing for me just because I had finally got to experience college life and felt confident about it. My first-year class and I were terribly upset about the news because of how tightly knit we were as a class and the amount of fun we were having while being together on the field and off in our free time. We had just accomplished a goal we had all had since we were little together to play collegiate softball, just for it to come to a stop after our first official game. I was heartbroken because I was in a happy space my freshman year. Living on my own in an apartment with five of my teammates and best friends, feeling independent, being just the right number of miles away from home where it was comfortable and appropriate to go home whenever I felt. Another challenge after that was trying to make money to save while being home from college and keep my family safe and free of Covid at the same time. I lived with my elderly grandmother during that time, so it was very difficult to work full-time at a restaurant serving, and not bring the virus home to my grandmother. As a server, we are exposed to multiple different tables and people throughout our entire shift. Touching people used plates, silverware, hovering over them as they ate with their masks down, exchanging cash and credit cards, etc. As a college athlete, we do not have time to work during our time on campus. Most of our time outside of class is devoted to practicing, games, sporting events, studying, meetings, team bonding, etc. So yes, during my time off from softball, I felt the need to work full-time to save and have money put away for when I did go back to campus. I am very independent and do not ask my parents or anyone for money. I am very grateful for the way my parents have raised me and the hustler mindset they have embedded in me over my adolescent years. Luckily, my family and I were Covid free until this past holiday season. I tested positive and was quarantined during New Years of 2021. It was depressing to see all my friends on social media having fun and going out for their New Years, while I stayed at home in a room eating things that I could not taste or smell. Luckily, my grandmother has stayed Covid free and healthy. In conclusion, I have battled through tough times that the Covid pandemic has set upon me.",
134,Female,WALTHAM,MA,2453,Yes,Permanent,Bentley University,Graduate Student,Masters of Business Administration (MBA),Masters in Business Analytics (MSBA),5/15/2023,,3.5,3.5,"Name: Huston-Tillotson University Degree pursued: Bachelors of Arts - Business Administration- Concentration: Accounting  City, State: Austin, Texas  Years attended: 2016-2020 ",Bentley University Business Analytics Society -Student Advisor- August 2021-Present Bentley Graduate Women's Leadership Organization- Student Advisor - August 2021-Present Bentley Graduate Student Association- Active Participant - August 2021-Present,"•Discover Bentley Scholarship: Scholarship given to outstanding students that participated in the Discover Bentley program for students interested in Bentley University's masters' programs.                                                                                                                                       Date awarded: August 2021-Present  •I.D.E.A.L Award for Excellence: a recognition award for the outstanding support of the core values throughout one's matriculation at Huston-Tillotson University. Date awarded: May 2021  •Black Pivotal Scholarship: Scholarship given to students that attended the black pivotal event and had exemplary participation, leadership qualities, and unique traits.                                                                                                                                                          Date awarded: March 2019  •AICPA Austin Chapter Scholarship: Scholarship given to students interested in taking the CPA examination. Date awarded: September 2018  •National Association of Black Accountants(NABA)  National Scholarship Recipient:  Scholarship given to deserving students looking to become business finance and accounting professionals.                                                      Date awarded: June 2017- June 2019  •National Association of Black Accountants (NABA)  Regional Scholarship Recipient: Scholarship given to deserving students looking to become business finance and accounting professionals. Date awarded: October 2018  •National Association of Black Accountants  (NABA) Austin Cen-Tex Chapter Scholarship Recipient: Scholarship given to deserving students looking to become business finance and accounting professionals. Date awarded: December 2018  •Rising Star Award: Award is given by Austin Cen-Tex NABA chapter for outstanding leadership, Date awarded: December 2018  •Dean List and Honor Roll                                                                                                                                            Date awarded: May 2017-May 2020  •Avery Arlington Scholarship Recipient: Scholarship given to international students who are passionate about serving as Christians and are committed to using their education to support their home country.                                                                        Date awarded:May 2017-May 2019  •Huston-Tillotson General Scholarship: Scholarship opportunity open for all HT students to apply. Date awarded: August 2017  •WEB DuBois Scholar: Huston-Tillotson Honor's program with exceptional academic and volunteer opportunities.                                                                                                                Date awarded: August 2016-May 2020  ",Bentley College,Other,"NABA HT Chapter President: August 2018-May 2020, NABA HT Treasurer: October 2016-May 2017, Toastmasters President HT Chapter: August 2018-May 2019  Golden Key Honors Society Treasurer August 2018- May 2020,  Pre-Alumni Council Treasurer August 2017-May 2018.",No,,,Not Applicable,Yes,Yes,"Spotify (Boston), PayPal (Boston), Zoom(Multiple Locations), Lyft (Multiple Locations), Plymouth Rock Assurance(Boston), EY(Boston)",No,No,,No,,No,,"""Mirabel seemed to have life figured out."", ""Ah, is it not you again, she is going to do very well"", ""she is going to be the next Okonjo Iweala!"" … These are some of the comments I grew up hearing. Okonjo Iweala, the current Director of World Trade Organization, was the charismatic personality my Economics Teacher in High School said I would be like. She had spoken about women in Nigeria taking over their finances and stance and I found myself wanting to help women on that journey. It was one of the reasons I chose to study Accounting as an undergraduate student. While these comments were seemingly harmless, they internally gave me burdens that I did not know how to empty.  Although it's a beautiful goal I had outlined, it came with a lot of anxiety, sleepless night and pressure to be this ""excellent representation"". I never really sat with my feelings, I just prayed, did my routines and moved to the next class or do whatever I needed to complete. I remember while as an undergrad, all I wanted to do was graduate but after graduation especially during covid, I felt this deep emptiness nothing else could fill. I was doing well in classes but wasn't really learning and assimilating the material. Yes, I oversaw many organizations on campus and did everything to the best of my abilities. I even got an award for excellence, but I was sad, depressed and felt alone. Worse, I had Covid, the deadly-killing virus that left me with a long-lasting brain fog. It was at that moment, I decided to slow down. I began questioning every single decision I have made. It was then I decided to see a therapist.  While reexamining what matters, which is the gift of life, I decided to treat myself with more kindness. I have always been in the mode of ""unto the next"", during my educational growth but now I am learning to live in the moment and focus on my life motto: ""being intentional about loving people and myself"".  My therapist said, ""Mirabel, it is wonderful that you have these goals, but you cannot not lift others as you climb if you have not learned to carry yourself up first"". It was so freeing to deeply understand that. As I healed physically from covid, I healed emotionally and mentally. The importance of mental health could no longer be underestimated. I had to share what I learned in therapy with other women that were also struggling with their mental health. I created a group chat to support young adults fighting the emptiness they feel. We shared multiple podcasts, songs, books like ""Cleaning Your Mental Mess"" by Dr Caroline Leaf, ""Set Boundaries, Find Peace"" by Nedra Tawwab and many more. Taking care of my mental health wasn't easy but has made me feel empowered to overcome our unique challenges and have gained a support system that seeks to keep on lifting as they climb.",
175,Female,beckley,WV,25801,Yes,Campus/Temporary,Bluffton University,Junior,Accounting,Business Administration,5/10/2023,,3.3,3.59,,2019 International Students Connect Bluffton University Investment Club 2021 Multicultural Students Organization (Treasurer),2021 Academic Deans List 2020 NABA Corporate Scholarship 2019 IM Scholarship,At Large,None,,No,,,,Yes,Yes,Ernst and Young LLC,Yes,No,,No,,No,,"Covid-19 gave the world an x-ray of the inequalities and weaknesses we are surrounded by. I know in my situation I was constantly worrying about whether the healthcare system in my country would support my parents or my grandparents. I constantly worried about my parents' business, if it would survive the pandemic because Zimbabwe just doesn't have facilities to support small businesses that are in person, what more businesses becoming largely remote? Simple transactions like telegraphic transfer for my tuition couldn't be performed. This burdened me. Being an international student is an emotional rollercoaster. This pandemic highlighted to me that I do not enjoy being so far from home because life is not guaranteed. One thing I struggled with was hearing about the deaths of those close to me. Many lives were lost during the pandemic, and I guess for me the battle I must face is acknowledging that this person who I left at home 6 months ago won't be there when I return. I constantly asked myself if this would be true of my parents or my siblings and if I would be able to process the death of my own blood. Would I be able to grieve alone here and restart this process when I go home, and the actual realities hit me? I had to overcome myself, my old ways of thinking, my feelings, and my biases. I realized that the only thing I could control was my mental health and my grades. Letting go of the ""what ifs"", made me lose a sense of control. I felt like I was in the unknown, I felt so hollow, so lost and so helpless. I mean what could I have done to stop the effects of this pandemic? Daily I took active steps to affirm myself, that one day when the travel ban is lifted, I will go home, and everyone will be alive. I kept saying to myself that ""this too shall pass"", I kept reminding myself that my feelings are not reliable because they change and fluctuate, but good habits will keep my grades high and keep me mentally sane and steady, my discipline held me when I couldn't hold myself together. These past few semesters I have learnt resilience and grit. I have learnt strength in so many ways. I have learnt to accept that my thoughts can be so shallow and can be easily clouded by my feelings. I learnt the importance of goal setting and overcoming. I always wanted to be the successful girl who took ginormous steps and leaps into success.  I have accepted that I am still a girl who wants to be successful, but I need to cultivate good habits. I need to take it one day at a time and always factor in the unknown, it is my duty to overcome.",
177,Male,Alexandria,VA,22309,Yes,Permanent,George Mason University,Senior,Accounting,none,5/20/2022,,3.46,3.46,AS Business Administration - NOVA 2018-2020 MS Accounting- Liberty University- 2021-2022,,,George Mason University,Other,Mason Accounting Society- vice president,No,,,,No,Yes,PwC and KPMG,,,,No,,Yes,Surgent CPA Review and Becker CPA Review,"My family was affected by the COVID pandemic. My parents lost their jobs, and the family depended on unemployment to survive. This saddened me because neither of my parents had a college education; I was a first-generation college student. This was a hard time for me because I was finishing up at a community college and transferring to a 4-year university. The expenses after financial aid were still more than we could afford. I had to take a full-time job at a local grocery store while doing my 15 credits for the semester. It was very stressful and hard for me because I had no time for myself. I worked at least 40 hours a week and spent my time off doing homework and studying. None of these discouraged me because my grades and relationship with my professors were great. Even with my cup full, I was making the presidential scholar list at my community college. This job taught me to value time and money well. These were my routines until my parents got a new job and I was able to reduce my hours to 15 a week. This pandemic taught me to not give up but work harder to achieve my goal. Some of my friends with whom I started community college dropped out to work full-time. They were not to be blamed because everyone is different and has different aspirations in life. With my aspiration to be a partner or a CFO at a big firm in the future, this pandemic could not overturn my dream.",
204,,,,,,,,,,,,,,,,,,,,,,,,,,,,,,,,,,,nan,
